,keyword,title,summary,date,href
435,финтех,Румен Радушев представя иновативните дигитални решения на Пощенска банка в сп. “HiComm”,"Заместник-началникът сектор “Банкиране на дребно” в Пощенска банка, Румен Радушев, коментира тенденциите в сектора в обзорния материал на списание “HiComm” “Преобразеното банкиране”. Той представя и иновациите в областта на финансовите услуги, които банката предстои да пусне на пазара.",17 май 2019,https://mediacenter.postbank.bg/%d1%80%d1%83%d0%bc%d0%b5%d0%bd-%d1%80%d0%b0%d0%b4%d1%83%d1%88%d0%b5%d0%b2-%d0%bf%d1%80%d0%b5%d0%b4%d1%81%d1%82%d0%b0%d0%b2%d1%8f-%d0%b8%d0%bd%d0%be%d0%b2%d0%b0%d1%82%d0%b8%d0%b2%d0%bd%d0%b8%d1%82/
436,финтех,Румен Радушев: Потребителското изживяване с дигиталното банкиране има човешко лице,"Румен Радушев, заместник-началник сектор “Банкиране на дребно“ в Пощенска банка, участва в четвъртото издание на международната конференция за дигитални финанси, финтех и банкови иновации Next DiFi.",3 октомври 2019,https://mediacenter.postbank.bg/%d1%80%d1%83%d0%bc%d0%b5%d0%bd-%d1%80%d0%b0%d0%b4%d1%83%d1%88%d0%b5%d0%b2-%d0%bf%d0%be%d1%82%d1%80%d0%b5%d0%b1%d0%b8%d1%82%d0%b5%d0%bb%d1%81%d0%ba%d0%be%d1%82%d0%be-%d0%b8%d0%b7%d0%b6%d0%b8%d0%b2/
437,финтех,Силно участие на Пощенска банка в престижния Финансов Форум Иновации,"Асен Ягодин, член на УС и изпълнителен директор на Пощенска банка, и Ангел Матеев, началник сектор „Банкиране на дребно“, взеха участие в престижния Финансов Форум Иновации, организиран от Асоциация „Банка на годината“.",14 юни 2019,https://mediacenter.postbank.bg/%d1%81%d0%b8%d0%bb%d0%bd%d0%be-%d1%83%d1%87%d0%b0%d1%81%d1%82%d0%b8%d0%b5-%d0%bd%d0%b0-%d0%bf%d0%be%d1%89%d0%b5%d0%bd%d1%81%d0%ba%d0%b0-%d0%b1%d0%b0%d0%bd%d0%ba%d0%b0-%d0%b2-%d0%bf%d1%80%d0%b5%d1%81/
438,финтех,Финансите в дигиталния свят – конференция на в. “Банкер”,"Как дигитализацията ще трансформира традиционните финансови услуги? Отговор на този въпрос дават водещи експерти от банковия и небанковия финансов сектор по време на втората годишна конференция “Финансите в дигиталния свят”, организирана от вестник “БАНКЕРЪ”. ",3 октомври 2017,https://mediacenter.postbank.bg/%d1%84%d0%b8%d0%bd%d0%b0%d0%bd%d1%81%d0%b8%d1%82%d0%b5-%d0%b2-%d0%b4%d0%b8%d0%b3%d0%b8%d1%82%d0%b0%d0%bb%d0%bd%d0%b8%d1%8f-%d1%81%d0%b2%d1%8f%d1%82-%d0%ba%d0%be%d0%bd%d1%84%d0%b5%d1%80%d0%b5/
439,машинно обучение,"Белян Белчев, началник на управление “Кредитна администрация” в Пощенска банка: Пощенска банка оптимизира процесите си с RPA",Интервю за сп. CIO.,30 октомври 2020,https://mediacenter.postbank.bg/%d0%b1%d0%b5%d0%bb%d1%8f%d0%bd-%d0%b1%d0%b5%d0%bb%d1%87%d0%b5%d0%b2-%d0%bd%d0%b0%d1%87%d0%b0%d0%bb%d0%bd%d0%b8%d0%ba-%d0%bd%d0%b0-%d1%83%d0%bf%d1%80%d0%b0%d0%b2%d0%bb%d0%b5%d0%bd%d0%b8%d0%b5-%d0%ba/
440,машинно обучение,Иновативните дигитални банкови канали са в основата на отличното потребителско изживяване,"Дигиталната трансформация и оптимизацията на услугите в банковия сектор бяха темите на обучителна дискусия, в която Лина Върбанова, Началник отдел CRM, Управление “Дигитално банкиране и CRM” в Пощенска банка представи актуалните тенденции в дигиталното банкиране пред ученици от 11-и клас от Националната търговско-банкова гимназия.",18 май 2020,https://mediacenter.postbank.bg/%d0%b8%d0%bd%d0%be%d0%b2%d0%b0%d1%82%d0%b8%d0%b2%d0%bd%d0%b8%d1%82%d0%b5-%d0%b4%d0%b8%d0%b3%d0%b8%d1%82%d0%b0%d0%bb%d0%bd%d0%b8-%d0%b1%d0%b0%d0%bd%d0%ba%d0%be%d0%b2%d0%b8-%d0%ba%d0%b0%d0%bd%d0%b0-2/
441,машинно обучение,Иновативните дигитални банкови канали са в основата на отличното потребителско изживяване,"Дигиталната трансформация и оптимизацията на услугите в банковия сектор бяха темите на обучителна дискусия, в която Лина Върбанова, Началник отдел CRM, Управление “Дигитално банкиране и CRM” в Пощенска банка представи актуалните тенденции в дигиталното банкиране пред ученици от 11-и клас от Националната търговско-банкова гимназия.",18 май 2020,https://mediacenter.postbank.bg/%d0%b8%d0%bd%d0%be%d0%b2%d0%b0%d1%82%d0%b8%d0%b2%d0%bd%d0%b8%d1%82%d0%b5-%d0%b4%d0%b8%d0%b3%d0%b8%d1%82%d0%b0%d0%bb%d0%bd%d0%b8-%d0%b1%d0%b0%d0%bd%d0%ba%d0%be%d0%b2%d0%b8-%d0%ba%d0%b0%d0%bd%d0%b0/
442,машинно обучение,Лина Върбанова: Навлизането на изкуствения интелект ще промени много бизнеси и голяма част от света ни,Осмото издание на международния форум за дигитални финанси Next DiFi се състоя в София,31 октомври 2023,https://mediacenter.postbank.bg/%d0%bb%d0%b8%d0%bd%d0%b0-%d0%b2%d1%8a%d1%80%d0%b1%d0%b0%d0%bd%d0%be%d0%b2%d0%b0-%d0%bd%d0%b0%d0%b2%d0%bb%d0%b8%d0%b7%d0%b0%d0%bd%d0%b5%d1%82%d0%be-%d0%bd%d0%b0-%d0%b8%d0%b7%d0%ba%d1%83%d1%81%d1%82/
443,роботизация,"Банките в новото десетилетие – споделена икономика, сливания и хиперсегментиране","Васил Панчев, CIO в Пощенска банка анализира пред списание „CIO“ предизвикателствата пред банките в новото десетилетие – споделена икономика, сливания и хиперсегментиране.",26 февруари 2020,https://mediacenter.postbank.bg/%d0%b1%d0%b0%d0%bd%d0%ba%d0%b8%d1%82%d0%b5-%d0%b2-%d0%bd%d0%be%d0%b2%d0%be%d1%82%d0%be-%d0%b4%d0%b5%d1%81%d0%b5%d1%82%d0%b8%d0%bb%d0%b5%d1%82%d0%b8%d0%b5-%d1%81%d0%bf%d0%be%d0%b4%d0%b5%d0%bb/
444,роботизация,Белян Белчев: Автоматизацията на бизнес процеси чрез софтуерни роботи гарантира тяхната надеждност и резултатност, За трета поредна година се проведе най-голямата конференция у нас за автоматизация на бизнес процеси,2 ноември 2022,https://mediacenter.postbank.bg/%d0%b1%d0%b5%d0%bb%d1%8f%d0%bd-%d0%b1%d0%b5%d0%bb%d1%87%d0%b5%d0%b2-%d0%b0%d0%b2%d1%82%d0%be%d0%bc%d0%b0%d1%82%d0%b8%d0%b7%d0%b0%d1%86%d0%b8%d1%8f%d1%82%d0%b0-%d0%bd%d0%b0-%d0%b1%d0%b8%d0%b7%d0%bd/
445,роботизация,"Илиян Котев, от екипа на Пощенска банка: Дигитализацията позволява на компаниите да станат проактивни","Илиян Котев отговаря и управлява 3-годишна стратегия за дигитална трансформация на Пощенска банка.<br>
„Началото на стратегията беше поставено през 2017-а и ще приключи през 2020. Дигиталната трансформация в банката е фокусирана към няколко области: едната са технологиите, които ще повишат клиентската удовлетвореност или ще подобрят клиентското изживяване. Втората насока е свързана с дигитализиране или подобряване, или опростяване на процесите вътре в организацията. Това директно или индиректно ще окаже въздействие върху клиентите ни или върху оперативните разходи и представянето на организацията. Друго важно нещо е промяната на мисленето на хората вътре в организацията“, г-н Котев обясни.",7 юни 2018,https://mediacenter.postbank.bg/%d0%b8%d0%bb%d0%b8%d1%8f%d0%bd-%d0%ba%d0%be%d1%82%d0%b5%d0%b2-%d0%be%d1%82-%d0%b5%d0%ba%d0%b8%d0%bf%d0%b0-%d0%bd%d0%b0-%d0%bf%d0%be%d1%89%d0%b5%d0%bd%d1%81%d0%ba%d0%b0-%d0%b1%d0%b0%d0%bd%d0%ba%d0%b0/
446,роботизация,Интересът към роботите в Пощенска банка е изключително голям и все повече звена откриват предимствата на технологията,Директорът на управление “Кредитна администрация” в банката Белян Белчев разказа в подкаста “Финанси на фокус” за успешното приложението на RPA технологията ,16 юни 2023,https://mediacenter.postbank.bg/%d0%b8%d0%bd%d1%82%d0%b5%d1%80%d0%b5%d1%81%d1%8a%d1%82-%d0%ba%d1%8a%d0%bc-%d1%80%d0%be%d0%b1%d0%be%d1%82%d0%b8%d1%82%d0%b5-%d0%b2-%d0%bf%d0%be%d1%89%d0%b5%d0%bd%d1%81%d0%ba%d0%b0-%d0%b1%d0%b0%d0%bd/
447,роботизация,Пощенска банка успешно внедри 6 робота в дейността на своята администрация,Чрез иновативната RPA технология банката оптимизира 20 стандартни процеса  в рамките на най-мащабния проект за роботизация в сектора.,4 август 2020,https://mediacenter.postbank.bg/%d0%bf%d0%be%d1%89%d0%b5%d0%bd%d1%81%d0%ba%d0%b0-%d0%b1%d0%b0%d0%bd%d0%ba%d0%b0-%d1%83%d1%81%d0%bf%d0%b5%d1%88%d0%bd%d0%be-%d0%b2%d0%bd%d0%b5%d0%b4%d1%80%d0%b8-6-%d1%80%d0%be%d0%b1%d0%be%d1%82%d0%b0/
448,иновация,Пощенска банка спечели две международни награди за своите дигитални иновации,Финансовата институция отчита 50% ръст на преводите през мобилното си банкиране m-Postbank на годишна база. ,24 януари 2022,https://mediacenter.postbank.bg/12760/
449,иновация,Филип Попов на #NEXT DIFI 2022: В Пощенска банка осигуряваме персонализирано клиентско преживяване с фокус върху взаимоотношенията с нашите клиенти,Водещият финансов форум се реализира с подкрепата на Пощенска банка,13 октомври 2022,https://mediacenter.postbank.bg/%d1%84%d0%b8%d0%bb%d0%b8%d0%bf-%d0%bf%d0%be%d0%bf%d0%be%d0%b2-%d0%bd%d0%b0-next-difi-2022-%d0%b2-%d0%bf%d0%be%d1%89%d0%b5%d0%bd%d1%81%d0%ba%d0%b0-%d0%b1%d0%b0%d0%bd%d0%ba%d0%b0-%d0%be%d1%81%d0%b8/
450,иновация,Филип Попов на #NEXT DIFI 2022: В Пощенска банка осигуряваме персонализирано клиентско преживяване с фокус върху взаимоотношенията с нашите клиенти,Водещият финансов форум се реализира с подкрепата на Пощенска банка,13 октомври 2022,https://mediacenter.postbank.bg/%d1%84%d0%b8%d0%bb%d0%b8%d0%bf-%d0%bf%d0%be%d0%bf%d0%be%d0%b2-%d0%bd%d0%b0-next-difi-2022-%d0%b2-%d0%bf%d0%be%d1%89%d0%b5%d0%bd%d1%81%d0%ba%d0%b0-%d0%b1%d0%b0%d0%bd%d0%ba%d0%b0-%d0%be%d1%81%d0%b8-2/
451,иновация,“Иноваторите говорят”: възстановяването на икономиката и ролята на банките дискутираме в подкаста “Финанси на фокус”,"Дончо Донев, началник отдел “Капиталови пазари” в Пощенска банка и главният икономист на Института за пазарна икономика Лъчезар Богданов са събеседници в поредния епизод на подкаста “Финанси на фокус”. ",12 юли 2021,https://mediacenter.postbank.bg/%d0%b8%d0%bd%d0%be%d0%b2%d0%b0%d1%82%d0%be%d1%80%d0%b8%d1%82%d0%b5-%d0%b3%d0%be%d0%b2%d0%be%d1%80%d1%8f%d1%82-%d0%b2%d1%8a%d0%b7%d1%81%d1%82%d0%b0%d0%bd%d0%be%d0%b2%d1%8f%d0%b2%d0%b0%d0%bd%d0%b5/
452,иновация,“Супер сметк@” спестява на клиентите на Пощенска банка разходите за месечна такса и дава допълнителни бонуси,Новата сметка за заплата преобръща представите за стандартния банков продукт. ,20 март 2017,https://mediacenter.postbank.bg/%d1%81%d1%83%d0%bf%d0%b5%d1%80-%d1%81%d0%bc%d0%b5%d1%82%d0%ba-%d1%81%d0%bf%d0%b5%d1%81%d1%82%d1%8f%d0%b2%d0%b0-%d0%bd%d0%b0-%d0%ba%d0%bb%d0%b8%d0%b5%d0%bd%d1%82%d0%b8%d1%82%d0%b5/
453,иновация,Mastercard UNIVERSE от Пощенска банка спечели престижно отличие в международния конкурс Elan Awards 2021,Финансовата институция е единственият победител от България в авторитетното състезание за най-добрите постижения в областта на картовия дизайн ,27 юни 2022,https://mediacenter.postbank.bg/mastercard-universe-%d0%be%d1%82-%d0%bf%d0%be%d1%89%d0%b5%d0%bd%d1%81%d0%ba%d0%b0-%d0%b1%d0%b0%d0%bd%d0%ba%d0%b0-%d1%81%d0%bf%d0%b5%d1%87%d0%b5%d0%bb%d0%b8-%d0%bf%d1%80%d0%b5%d1%81%d1%82%d0%b8%d0%b6/
454,иновация,Ангел Матеев и Момчил Игнатов представиха успешното партньорство на Пощенска банка и бизнеса в условията на извънредна обстановка,"Ангел Матеев, началник Сектор “Банкиране на дребно” и Момчил Игнатов, началник отдел “Средни корпоративни клиенти” в управление “Корпоративно банкиране” представиха Пощенска банка на уебинара “Как банките си партнират с бизнеса в извънредна обстановка”. ",4 юни 2020,https://mediacenter.postbank.bg/%d0%b0%d0%bd%d0%b3%d0%b5%d0%bb-%d0%bc%d0%b0%d1%82%d0%b5%d0%b5%d0%b2-%d0%b8-%d0%bc%d0%be%d0%bc%d1%87%d0%b8%d0%bb-%d0%b8%d0%b3%d0%bd%d0%b0%d1%82%d0%be%d0%b2-%d0%bf%d1%80%d0%b5%d0%b4%d1%81%d1%82%d0%b0/
455,иновация,Ангел Матеев и Момчил Игнатов представиха успешното партньорство на Пощенска банка и бизнеса в условията на извънредна обстановка,"Ангел Матеев, началник Сектор “Банкиране на дребно” и Момчил Игнатов, началник отдел “Средни корпоративни клиенти” в управление “Корпоративно банкиране” представиха Пощенска банка на уебинара “Как банките си партнират с бизнеса в извънредна обстановка”. ",4 юни 2020,https://mediacenter.postbank.bg/%d0%b0%d0%bd%d0%b3%d0%b5%d0%bb-%d0%bc%d0%b0%d1%82%d0%b5%d0%b5%d0%b2-%d0%b8-%d0%bc%d0%be%d0%bc%d1%87%d0%b8%d0%bb-%d0%b8%d0%b3%d0%bd%d0%b0%d1%82%d0%be%d0%b2-%d0%bf%d1%80%d0%b5%d0%b4%d1%81%d1%82%d0%b0-2/
456,иновация,"Белян Белчев участва в конференция, посветена на технологиите за роботизирана автоматизация на процесите","Белян Белчев, началник на управление “Кредитна администрация” в Пощенска банка, участва в първата конференция в региона на тема “Hyperautomation – Level up your business and scale up success”.",28 септември 2021,https://mediacenter.postbank.bg/%d0%b1%d0%b5%d0%bb%d1%8f%d0%bd-%d0%b1%d0%b5%d0%bb%d1%87%d0%b5%d0%b2-%d1%83%d1%87%d0%b0%d1%81%d1%82%d0%b2%d0%b0-%d0%b2-%d0%ba%d0%be%d0%bd%d1%84%d0%b5%d1%80%d0%b5%d0%bd%d1%86%d0%b8%d1%8f-%d0%bf%d0%be/
457,иновация,"Белян Белчев, началник на управление “Кредитна администрация” в Пощенска банка: Пощенска банка оптимизира процесите си с RPA",Интервю за сп. CIO.,30 октомври 2020,https://mediacenter.postbank.bg/%d0%b1%d0%b5%d0%bb%d1%8f%d0%bd-%d0%b1%d0%b5%d0%bb%d1%87%d0%b5%d0%b2-%d0%bd%d0%b0%d1%87%d0%b0%d0%bb%d0%bd%d0%b8%d0%ba-%d0%bd%d0%b0-%d1%83%d0%bf%d1%80%d0%b0%d0%b2%d0%bb%d0%b5%d0%bd%d0%b8%d0%b5-%d0%ba/
458,иновация,Високотехнологичната услуга Smart POS by Postbank превръща смартфона в ПОС терминал,"Пощенска банка е първата банка в България, която ще предложи иновация за безконтактни плащания директно през мобилен телефон. ",29 септември 2021,https://mediacenter.postbank.bg/%d0%b2%d0%b8%d1%81%d0%be%d0%ba%d0%be%d1%82%d0%b5%d1%85%d0%bd%d0%be%d0%bb%d0%be%d0%b3%d0%b8%d1%87%d0%bd%d0%b0%d1%82%d0%b0-%d1%83%d1%81%d0%bb%d1%83%d0%b3%d0%b0-smart-pos-postbank-%d0%bf%d1%80%d0%b5/
459,иновация,Дамите – нежност и сила в света на парите,"Жените притежават необходимата дисциплина, съсредоточеност и стремеж към самоутвърждаване, което им помага да успяват в “света на парите”, коментира Петя Димитрова, главен изпълнителен директор на Пощенска банка в интервю за сп. Жената днес",17 октомври 2013,https://mediacenter.postbank.bg/%d0%b4%d0%b0%d0%bc%d0%b8%d1%82%d0%b5-%d0%bd%d0%b5%d0%b6%d0%bd%d0%be%d1%81%d1%82-%d0%b8-%d1%81%d0%b8%d0%bb%d0%b0-%d0%b2-%d1%81%d0%b2%d0%b5%d1%82%d0%b0-%d0%bd%d0%b0-%d0%bf%d0%b0%d1%80%d0%b8/
460,иновация,Даниела Иванова участва в дискусия на тема “Пазарът на имоти в динамична среда”,Последната за годината експертна бизнес дискусия на тема “Пазарът на имоти в динамична среда” бе организирана от сайта за обяви за недвижими имоти Imoti.net се проведе в София. ,23 ноември 2022,https://mediacenter.postbank.bg/%d0%b4%d0%b0%d0%bd%d0%b8%d0%b5%d0%bb%d0%b0-%d0%b8%d0%b2%d0%b0%d0%bd%d0%be%d0%b2%d0%b0-%d1%83%d1%87%d0%b0%d1%81%d1%82%d0%b2%d0%b0-%d0%b2-%d0%b4%d0%b8%d1%81%d0%ba%d1%83%d1%81%d0%b8%d1%8f-%d0%bd%d0%b0/
461,иновация,Даниела Иванова участва в експертна дискусия за имотния сектор и пазара на жилища в София,Водещият портал за обяви на недвижими имоти Imoti.net организира експертна дискусия за имотния сектор с фокус върху пазара на жилища в София. ,19 октомври 2021,https://mediacenter.postbank.bg/%d0%b4%d0%b0%d0%bd%d0%b8%d0%b5%d0%bb%d0%b0-%d0%b8%d0%b2%d0%b0%d0%bd%d0%be%d0%b2%d0%b0-%d1%83%d1%87%d0%b0%d1%81%d1%82%d0%b2%d0%b0-%d0%b2-%d0%b5%d0%ba%d1%81%d0%bf%d0%b5%d1%80%d1%82%d0%bd%d0%b0-%d0%b4/
462,иновация,Даниела Иванова участва в експертна дискусия за имотния сектор и пазара на жилища в София,Водещият портал за обяви на недвижими имоти Imoti.net организира експертна дискусия за имотния сектор с фокус върху пазара на жилища в София. ,19 октомври 2021,https://mediacenter.postbank.bg/%d0%b4%d0%b0%d0%bd%d0%b8%d0%b5%d0%bb%d0%b0-%d0%b8%d0%b2%d0%b0%d0%bd%d0%be%d0%b2%d0%b0-%d1%83%d1%87%d0%b0%d1%81%d1%82%d0%b2%d0%b0-%d0%b2-%d0%b5%d0%ba%d1%81%d0%bf%d0%b5%d1%80%d1%82%d0%bd%d0%b0-%d0%b4-2/
463,иновация,"Даниела Иванова: В Пощенска банка използваме модерни технологии, за да предоставим на клиентите иновативни и висококачествени дигитални решения","В София се състоя първата за годината бизнес дискусия, организирана от сайта за недвижими имоти Imoti.net. ",28 март 2022,https://mediacenter.postbank.bg/%d0%b4%d0%b0%d0%bd%d0%b8%d0%b5%d0%bb%d0%b0-%d0%b8%d0%b2%d0%b0%d0%bd%d0%be%d0%b2%d0%b0-%d0%b2-%d0%bf%d0%be%d1%89%d0%b5%d0%bd%d1%81%d0%ba%d0%b0-%d0%b1%d0%b0%d0%bd%d0%ba%d0%b0-%d0%b8%d0%b7%d0%bf%d0%be/
464,иновация,Димитър Шумаров: Отлично структурираните функционалности на иновацията Smart POS я превръщат в предпочитана от бизнеси с всякакъв мащаб,"Димитър Шумаров, главен финансов и изпълнителен директор на Пощенска банка участва в онлайн семинар “БОРИКА нова генерация 2021“.",10 ноември 2021,https://mediacenter.postbank.bg/%d0%b4%d0%b8%d0%bc%d0%b8%d1%82%d1%8a%d1%80-%d1%88%d1%83%d0%bc%d0%b0%d1%80%d0%be%d0%b2-%d0%be%d1%82%d0%bb%d0%b8%d1%87%d0%bd%d0%be-%d1%81%d1%82%d1%80%d1%83%d0%ba%d1%82%d1%83%d1%80%d0%b8%d1%80%d0%b0/
465,иновация,Димитър Шумаров: Отлично структурираните функционалности на иновацията Smart POS я превръщат в предпочитана от бизнеси с всякакъв мащаб,"Димитър Шумаров, главен финансов и изпълнителен директор на Пощенска банка участва в онлайн семинар “БОРИКА нова генерация 2021“.",10 ноември 2021,https://mediacenter.postbank.bg/%d0%b4%d0%b8%d0%bc%d0%b8%d1%82%d1%8a%d1%80-%d1%88%d1%83%d0%bc%d0%b0%d1%80%d0%be%d0%b2-%d0%be%d1%82%d0%bb%d0%b8%d1%87%d0%bd%d0%be-%d1%81%d1%82%d1%80%d1%83%d0%ba%d1%82%d1%83%d1%80%d0%b8%d1%80%d0%b0-2/
466,иновация,Жилищното кредитиране в България навлиза в нова фаза. Вървим уверено към пазарните модели в Западна Европа,"Интервю с Румен Радушев, началник управление “Жилищно кредитиране” в Пощенска банка, за сп. Forbs",17 октомври 2013,https://mediacenter.postbank.bg/%d0%b6%d0%b8%d0%bb%d0%b8%d1%89%d0%bd%d0%be%d1%82%d0%be-%d0%ba%d1%80%d0%b5%d0%b4%d0%b8%d1%82%d0%b8%d1%80%d0%b0%d0%bd%d0%b5-%d0%b2-%d0%b1%d1%8a%d0%bb%d0%b3%d0%b0%d1%80%d0%b8%d1%8f-%d0%bd%d0%b0%d0%b2/
467,иновация,"Интервю на Петя Димитрова за “Капитал“, конференция “FinTech Summit” 2021","Навлизането на финтех компаниите в сектора активира един режим на “здравословна конкуренция“, която вече даде своите положителни резултати. ",31 март 2021,https://mediacenter.postbank.bg/%d0%b8%d0%bd%d1%82%d0%b5%d1%80%d0%b2%d1%8e-%d0%bd%d0%b0-%d0%bf%d0%b5%d1%82%d1%8f-%d0%b4%d0%b8%d0%bc%d0%b8%d1%82%d1%80%d0%be%d0%b2%d0%b0-%d0%b7%d0%b0-%d0%ba%d0%b0%d0%bf%d0%b8%d1%82%d0%b0%d0%bb/
