,keyword,title,summary,date,href
0,artificial intelligence,Bank digitalization,4 January 2018.,4 януари 2018,https://mediacenter.postbank.bg/bank-digitalization/
1,artificial intelligence,"Mrs. Petia Dimitrova, Chief Executive Officer and Chairperson of the Management Board of Postbank: We change banking through innovation",Interview for Economic Magazine.,24 март 2021,https://mediacenter.postbank.bg/mrs-petia-dimitrova-chief-executive-officer-chairperson-management-board-postbank-change-banking-innovation/
2,artificial intelligence,"Petia Dimitrova, CEO and Chairperson of the Management Board of Postbank: Today, Bulgarian companies use only deposits for financing",The asset quality review of Bulgarian banks aimed at reassuring society after the case with Corporate Commercial Bank. ,1 ноември 2017,https://mediacenter.postbank.bg/petia-dimitrova-ceo-chairperson-management-board-postbank-today-bulgarian-companies-deposits-financing/
3,artificial intelligence,"Petia Dimitrova, CEO of Postbank: You encourage the good example",Ikonomika Magazine.,29 май 2020,https://mediacenter.postbank.bg/petia-dimitrova-ceo-postbank-encourage-good/
4,artificial intelligence,Petia Dimitrova: Banking in a Digital World,"Petia Dimitrova, CEO and Chairperson of the Management Board of Postbank for CIO Times and its special edition “Most High-Impact Women Leaders Making a Difference, 2021“",1 февруари 2022,https://mediacenter.postbank.bg/petia-dimitrova-banking-digital-world/
5,artificial intelligence,Petia Dimitrova: Banks in Bulgaria are an indispensable factor in the prosperity of the economy,"Interview with Petia Dimitrova, Chief Executive Officer and Chairperson of the Executive Board of Postbank and Chairperson of ABB for the “Trud News”",20 декември 2023,https://mediacenter.postbank.bg/petia-dimitrova-banks-bulgaria-indispensable-factor-prosperity-economy-strategic-stability-country/
6,artificial intelligence,"Petia Dimitrova: By acquiring BNP Paribas Personal Finance, we will establish ourselves as the bank of choice for individual clients","Interview with Petia Dimitrova, Chief Executive Officer and Chairperson of the Management Board of Postbank for Investor.bg",5 януари 2023,https://mediacenter.postbank.bg/petia-dimitrova-acquiring-bnp-paribas-personal-finance-establish-bank-choice-individual-clients/
7,artificial intelligence,Petia Dimitrova: Success is only a step towards new success,"The year is going well and I expect it to be successful one for households and businesses, as well as for the banks. ",29 юни 2017,https://mediacenter.postbank.bg/petia-dimitrova-success-step-success/
8,artificial intelligence,Petia Dimitrova: The banking digitalization is our mission,We are moving at our customers’ pace and we are trying to be one step ahead of them at the same time.,20 март 2018,https://mediacenter.postbank.bg/petia-dimitrova-banking-digitalization-mission/
9,artificial intelligence,Petia Dimitrova: The challenging environment drives us to be even bigger winners,"Interview with Petia Dimitrova, Chief Executive Officer and Chairperson of the Management Board of Postbank for the Investor Digest Magazine",7 април 2023,https://mediacenter.postbank.bg/petia-dimitrova-challenging-environment-drives-bigger-winners/
10,artificial intelligence,The bank in your smartphone,"The first thing Petia Dimitrova, CEO and chairman of the Management Board at Postbank, does when he arrives in her office in the morning is to check her special hotline. ",25 октомври 2017,https://mediacenter.postbank.bg/bank-smartphone/
11,artificial intelligence,"Петя Димитрова, Мисис Икономика 2018: Дигитализацията е дълъг път, който ще извървим","Петя Димитрова, Мисис Икономика 2018: Дигитализацията е дълъг път, който ще извървим
сп. “Икономика” Петя Димитрова е главен изпълнителен директор и председател на Управителния съвет на Пощенска банка. Член е и на УС на Асоциацията на банките в България Изпълнена съм c респект и благодарност към всички, които са оценили нашия труд и нашето развитие през тези години. Това е награда за целия ни екип. Резултатите ни
20 декември 2018
Научете повече",20 декември 2018,https://mediacenter.postbank.bg/%d0%bf%d0%b5%d1%82%d1%8f-%d0%b4%d0%b8%d0%bc%d0%b8%d1%82%d1%80%d0%be%d0%b2%d0%b0-%d0%bc%d0%b8%d1%81%d0%b8%d1%81-%d0%b8%d0%ba%d0%be%d0%bd%d0%be%d0%bc%d0%b8%d0%ba%d0%b0-2018-%d0%b4%d0%b8%d0%b3%d0%b8/
12,artificial intelligence,Пощенска банка предлага атрактивна възможност за инвестиция в застрахователен продукт “Еверест V“ на Булстрад Живот,"Банката предлага и разнообразни спестовни решения, като структурирани депозити, които осигуряват възможност за допълнителна доходност",3 юни 2022,https://mediacenter.postbank.bg/%d0%bf%d0%be%d1%89%d0%b5%d0%bd%d1%81%d0%ba%d0%b0-%d0%b1%d0%b0%d0%bd%d0%ba%d0%b0-%d0%bf%d1%80%d0%b5%d0%b4%d0%bb%d0%b0%d0%b3%d0%b0-%d0%b0%d1%82%d1%80%d0%b0%d0%ba%d1%82%d0%b8%d0%b2%d0%bd%d0%b0-%d0%b2/
13, AI ,"World Finance Magazine, Winter issue – January 2022 Petia Dimitrova, Chief Executive Officer and Chairperson of the Management Board of Postbank",Petia Dimitrova: Digitalization will set us even more ambitious goals for the future. ,4 януари 2022,https://mediacenter.postbank.bg/world-finance-magazine-winter-issue-january-2022-petia-dimitrova-chief-executive-officer-chairperson-management-board-postbank/
14, AI ,Пощенска банка спечели две международни награди за своите дигитални иновации,Финансовата институция отчита 50% ръст на преводите през мобилното си банкиране m-Postbank на годишна база. ,24 януари 2022,https://mediacenter.postbank.bg/12760/
15, AI ,Стартира стажантската програма на Пощенска банка,Стажът дава възможност на талантливи млади хора да натрупат знания и опит във водеща финансова институция.,17 май 2021,https://mediacenter.postbank.bg/%d1%81%d1%82%d0%b0%d1%80%d1%82%d0%b8%d1%80%d0%b0-%d1%81%d1%82%d0%b0%d0%b6%d0%b0%d0%bd%d1%82%d1%81%d0%ba%d0%b0%d1%82%d0%b0-%d0%bf%d1%80%d0%be%d0%b3%d1%80%d0%b0%d0%bc%d0%b0-%d0%bd%d0%b0-%d0%bf%d0%be/
16, AI ,Стартира стажантската програма на Пощенска банка,Стажът дава възможност на талантливи млади хора да натрупат знания и опит във водеща финансова институция.,17 май 2021,https://mediacenter.postbank.bg/%d1%81%d1%82%d0%b0%d1%80%d1%82%d0%b8%d1%80%d0%b0-%d1%81%d1%82%d0%b0%d0%b6%d0%b0%d0%bd%d1%82%d1%81%d0%ba%d0%b0%d1%82%d0%b0-%d0%bf%d1%80%d0%be%d0%b3%d1%80%d0%b0%d0%bc%d0%b0-%d0%bd%d0%b0-%d0%bf%d0%be-2/
17, AI ,Четири компании са отличени в програмата за растеж на Ендевър – Dare to Scale 2022,"Печелившите са Sofia Electric Brewing, Appolica, C4 Nexus и Swipe.bg",14 декември 2022,https://mediacenter.postbank.bg/%d1%87%d0%b5%d1%82%d0%b8%d1%80%d0%b8-%d0%ba%d0%be%d0%bc%d0%bf%d0%b0%d0%bd%d0%b8%d0%b8-%d1%81%d0%b0-%d0%be%d1%82%d0%bb%d0%b8%d1%87%d0%b5%d0%bd%d0%b8-%d0%b2-%d0%bf%d1%80%d0%be%d0%b3%d1%80%d0%b0%d0%bc/
18, AI ,Четири компании са отличени в програмата за растеж на Ендевър – Dare to Scale 2022,"Печелившите са Sofia Electric Brewing, Appolica, C4 Nexus и Swipe.bg",14 декември 2022,https://mediacenter.postbank.bg/%d1%87%d0%b5%d1%82%d0%b8%d1%80%d0%b8-%d0%ba%d0%be%d0%bc%d0%bf%d0%b0%d0%bd%d0%b8%d0%b8-%d1%81%d0%b0-%d0%be%d1%82%d0%bb%d0%b8%d1%87%d0%b5%d0%bd%d0%b8-%d0%b2-%d0%bf%d1%80%d0%be%d0%b3%d1%80%d0%b0%d0%bc-2/
19, AI ,“Играй футбол с PELE” стартират бензиностанции “ЕКО” в партньорство с Пощенска банка,"“Играй футбол с PELE” стартират бензиностанции “ЕКО” в партньорство с Пощенска банка
За първи път българските фенове ще могат да се сдобият с оригинални аксесоари с едноименната марка на футболната легенда PЕLE За първи път българските футболни фенове ще могат да се сдобият с оригинални аксесоари с едноименната марка на футболната легенда PЕLE. В партньорство с Пощенска банка (www.postbank.bg) верига бензиностанции “ЕКО” стартира атрактивна промоция по повод
17 април 2014
Научете повече",17 април 2014,https://mediacenter.postbank.bg/%d0%b8%d0%b3%d1%80%d0%b0%d0%b9-%d1%84%d1%83%d1%82%d0%b1%d0%be%d0%bb-%d1%81-pele-%d1%81%d1%82%d0%b0%d1%80%d1%82%d0%b8%d1%80%d0%b0%d1%82-%d0%b1%d0%b5%d0%bd%d0%b7%d0%b8%d0%bd%d0%be/
20, AI ,"“Иноваторите говорят” – как избираме нов дом в новата реалност, слушайте в епизод 2 на “Финанси на фокус”",Как се промени имотния пазар и поведението на клиентите след пандемията обсъждат в епизод 2 на подкаста “Финанси на фокус”.,21 юни 2021,https://mediacenter.postbank.bg/%d0%b8%d0%bd%d0%be%d0%b2%d0%b0%d1%82%d0%be%d1%80%d0%b8%d1%82%d0%b5-%d0%b3%d0%be%d0%b2%d0%be%d1%80%d1%8f%d1%82-%d0%ba%d0%b0%d0%ba-%d0%b8%d0%b7%d0%b1%d0%b8%d1%80%d0%b0%d0%bc%d0%b5-%d0%bd/
21, AI ,"“Иноваторите говорят” – как избираме нов дом в новата реалност, слушайте в епизод 2 на “Финанси на фокус”",Как се промени имотния пазар и поведението на клиентите след пандемията обсъждат в епизод 2 на подкаста “Финанси на фокус”.,21 юни 2021,https://mediacenter.postbank.bg/%d0%b8%d0%bd%d0%be%d0%b2%d0%b0%d1%82%d0%be%d1%80%d0%b8%d1%82%d0%b5-%d0%b3%d0%be%d0%b2%d0%be%d1%80%d1%8f%d1%82-%d0%ba%d0%b0%d0%ba-%d0%b8%d0%b7%d0%b1%d0%b8%d1%80%d0%b0%d0%bc%d0%b5-%d0%bd-2/
22, AI ,10 компании влизат в програмата за растеж на Endeavor – Dare to Scale,"Българският офис на глобалната мрежа Endeavor избра предприемачи от 10 български компании с голям потенциал за растеж за пилотното издание на новата си програма за растеж Dare to Scale – първата от този род в България, която е насочена към бизнеси, които вече са преминали през стартъп фазата.",20 юни 2019,https://mediacenter.postbank.bg/10-%d0%ba%d0%be%d0%bc%d0%bf%d0%b0%d0%bd%d0%b8%d0%b8-%d0%b2%d0%bb%d0%b8%d0%b7%d0%b0%d1%82-%d0%b2-%d0%bf%d1%80%d0%be%d0%b3%d1%80%d0%b0%d0%bc%d0%b0%d1%82%d0%b0-%d0%b7%d0%b0-%d1%80%d0%b0%d1%81%d1%82%d0%b5/
23, AI ,NA,"Промоцията е валидна от 11 февруари до 11 април във всички магазини на веригата в цялата страна Пощенска банка (www.postbank.bg) стартира нова промоционална кампания съвместно със супермаркети Пикадили и Пикадили Daily за всички съществуващи и нови клиенти на кредитни карти American Express, Euroline American Express и Visa. В периода 11 февруари – 11 април 2013
11 февруари 2013
Научете повече",11 февруари 2013,https://mediacenter.postbank.bg/10-%d0%be%d1%82%d1%81%d1%82%d1%8a%d0%bf%d0%ba%d0%b0-%d0%b2-%d0%bc%d0%b0%d0%b3%d0%b0%d0%b7%d0%b8%d0%bd%d0%b8-%d0%bf%d0%b8%d0%ba%d0%b0%d0%b4%d0%b8%d0%bb%d0%b8/
24, AI ,22-ма предприемачи от 12 компании влизат в петото издание на Dare to Scale,"Компаниите, част от новата кохорта, са генерирали приходи от над 15 млн. лева за изминалата година",8 юни 2023,https://mediacenter.postbank.bg/22-%d0%bc%d0%b0-%d0%bf%d1%80%d0%b5%d0%b4%d0%bf%d1%80%d0%b8%d0%b5%d0%bc%d0%b0%d1%87%d0%b8-%d0%be%d1%82-12-%d0%ba%d0%be%d0%bc%d0%bf%d0%b0%d0%bd%d0%b8%d0%b8-%d0%b2%d0%bb%d0%b8%d0%b7%d0%b0%d1%82-%d0%b2/
25, AI ,"Asen Yagodin: In Postbank, we develop sustainable financing through priority support for green businesses","Interview with Asen Yagodin, Executive Officer and Member of the Management Board of Postbank for 24 “chasa”",8 април 2023,https://mediacenter.postbank.bg/asen-yagodin-postbank-develop-sustainable-financing-priority-support-green-businesses/
26, AI ,Bank digitalization,4 January 2018.,4 януари 2018,https://mediacenter.postbank.bg/bank-digitalization/
27, AI ,Bulgaria on course for euro adoption,"Petia Dimitrova, Chief Executive Officer and Chairperson of the Management Board of Postbank and of the Executive Board of the Association of Banks in Bulgaria (ABB) for World Finance Magazine, Summer issue – June 2023",26 юни 2023,https://mediacenter.postbank.bg/banks-preparing-adoption-single-european-currency-continue-actively-support-development-economy/
28, AI ,NA,"EFG Factors S.A. клон България стана член на асоциацията на водещите факторинг компании в света 5 февруари 2007 г., София EFG Factors S.A. клон България стана пълноправен член на международната асоциация на водещите факторинг компании в света. Факторинг компанията на Пощенска банка е първият представител на страната ни в Factors Chain International (FCI). Реномираната международна
5 февруари 2007
Научете повече",5 февруари 2007,https://mediacenter.postbank.bg/efg-factors-s-a-%d0%ba%d0%bb%d0%be%d0%bd-%d0%b1%d1%8a%d0%bb%d0%b3%d0%b0%d1%80%d0%b8%d1%8f-%d1%81%d1%82%d0%b0%d0%bd%d0%b0-%d1%87%d0%bb%d0%b5%d0%bd-%d0%bd%d0%b0-%d0%b0%d1%81%d0%be%d1%86%d0%b8%d0%b0/
29, AI ,Escreo ще решава проблем номер 1 в офиса – шумът,"В близкото бъдеще светът ще принадлежи на създаващите. ESCREO прекрасно знаят това и преобразяват офисите на над 2000 компании със своите бои, които превръщат всяка повърхност в дъска за писане. Амбициозната компания вече е част от програмата за растеж “Dare to Scale” на Endeavor Bulgaria и смело преследва мечтаното развитие.",16 септември 2019,https://mediacenter.postbank.bg/escreo-%d1%89%d0%b5-%d1%80%d0%b5%d1%88%d0%b0%d0%b2%d0%b0-%d0%bf%d1%80%d0%be%d0%b1%d0%bb%d0%b5%d0%bc-%d0%bd%d0%be%d0%bc%d0%b5%d1%80-1-%d0%b2-%d0%be%d1%84%d0%b8%d1%81%d0%b0/
30, AI ,NA,"  ПРАВИЛА ЗА УЧАСТИЕ   От 14.11.2022 г. до 17.11.2022 г. в Instagram страницата на Пощенска банка ще бъде публикувана играта “Как се казва нашият иновативен, AI базиран, дигитален финансов асистент?” Всеки изпълнил правилно игровото стори има право на участие в играта. Никакви други действия няма да бъдат считани за заявка за участие. Всеки изпълнил
11 ноември 2022
Научете повече",11 ноември 2022,https://mediacenter.postbank.bg/instagram-%d0%b8%d0%b3%d1%80%d0%b0-%d0%ba%d0%b0%d0%ba-%d1%81%d0%b5-%d0%ba%d0%b0%d0%b7%d0%b2%d0%b0-%d0%bd%d0%b0%d1%88%d0%b8%d1%8f%d1%82-%d0%b8%d0%bd%d0%be%d0%b2%d0%b0%d1%82%d0%b8%d0%b2%d0%b5%d0%bd-ai/
31, AI ,Moré Noir разчупва клишетата за красота,"Moré Noir e една от 10-те компании, участници в Dare to Scale на Endeavor с основен партньор Пощенска банка. Moré Noir е български бранд за бански костюми, зад който седят сестрите Сандра и Карла Клинчеви. Компанията създава колекции, с които руши модни бариери – експериментира със стила, дизайна и материите. Брандът е създаден преди 3 години и вече продава на няколко места по света.",27 септември 2019,https://mediacenter.postbank.bg/more-noir-%d1%80%d0%b0%d0%b7%d1%87%d1%83%d0%bf%d0%b2%d0%b0-%d0%ba%d0%bb%d0%b8%d1%88%d0%b5%d1%82%d0%b0%d1%82%d0%b0-%d0%b7%d0%b0-%d0%ba%d1%80%d0%b0%d1%81%d0%be%d1%82%d0%b0/
32, AI ,"Mrs. Petia Dimitrova, Chief Executive Officer and Chairperson of the Management Board of Postbank: We change banking through innovation",Interview for Economic Magazine.,24 март 2021,https://mediacenter.postbank.bg/mrs-petia-dimitrova-chief-executive-officer-chairperson-management-board-postbank-change-banking-innovation/
33, AI ,Mеждународният “Фестивал на усмивките” ще гостува в Нощта на изкуствата в Стара Загорa,"На 30 септември Международният фестивал за пощенско изкуство (Mail Art), хумористична рисунка и карикатура ще гостува в Нощта на изкуствата в Стара Загора със Smile Art хепънинг.",21 септември 2016,https://mediacenter.postbank.bg/m%d0%b5%d0%b6%d0%b4%d1%83%d0%bd%d0%b0%d1%80%d0%be%d0%b4%d0%bd%d0%b8%d1%8f%d1%82-%d1%84%d0%b5%d1%81%d1%82%d0%b8%d0%b2%d0%b0%d0%bb-%d0%bd%d0%b0-%d1%83%d1%81%d0%bc%d0%b8%d0%b2%d0%ba%d0%b8%d1%82/
34, AI ,Petia Dimitrova at Banks and Business: We Are Ready for New Bank Acquisitions,"“I expect the processes of consolidation in the Bulgarian banking sector to develop. We closely follow the dynamics and all opportunities on the market, and we are ready to participate in further such deals, as the international Eurobank group we are part of has the green light for more investment in Bulgaria,” pointed out Petia Dimitrova. ",2 декември 2021,https://mediacenter.postbank.bg/petia-dimitrova-banks-business-ready-bank-acquisitions/
35, AI ,Petia Dimitrova for CIO Views: The Ripple Effect – One Woman’s Story of transforming the Banking World,The 10 Most Influential Businesswomen to Watch in 2022. ,17 февруари 2022,https://mediacenter.postbank.bg/petia-dimitrova-cio-views-ripple-effect-womans-story-transforming-banking-world/
36, AI ,Petia Dimitrova talks to 24 Chasa: We are launching a large-scale transformation of our even bigger branch network in order to provide excellent consumer experience,"We were able to acquire Piraeus Bank Bulgaria in a record short time, which makes Postbank even bigger and stronger.",30 ноември 2019,https://mediacenter.postbank.bg/petia-dimitrova-talks-24-chasa-launching-large-scale-transformation-bigger-branch-network-order-provide-excellent-consumer-experience/
37, AI ,"Petia Dimitrova, CEO and Chairperson of the Management Board of Postbank",: I believe it is better to lead and pave paths than to follow in somebody else’s steps.,19 август 2017,https://mediacenter.postbank.bg/petia-dimitrova-ceo-chairperson-management-board-postbank/
38, AI ,"Petia Dimitrova, CEO and Chairperson of the Management Board of Postbank: Experience is not transferable",Forbes Magazine presents Petia Dimitrova as one of “The 20 most influential women in business in Bulgaria”.,6 февруари 2020,https://mediacenter.postbank.bg/petia-dimitrova-ceo-chairperson-management-board-postbank-experience-transferable/
39, AI ,"Petia Dimitrova, CEO and Chairperson of the Management Board of Postbank: Today, Bulgarian companies use only deposits for financing",The asset quality review of Bulgarian banks aimed at reassuring society after the case with Corporate Commercial Bank. ,1 ноември 2017,https://mediacenter.postbank.bg/petia-dimitrova-ceo-chairperson-management-board-postbank-today-bulgarian-companies-deposits-financing/
40, AI ,"Petia Dimitrova, CEO of Postbank: You encourage the good example",Ikonomika Magazine.,29 май 2020,https://mediacenter.postbank.bg/petia-dimitrova-ceo-postbank-encourage-good/
41, AI ,"Petia Dimitrova, Chief Executive Officer and Chairperson of the Management Board of Postbank",06 December 2019.,6 декември 2019,https://mediacenter.postbank.bg/petia-dimitrova-chief-executive-officer-chairperson-management-board-postbank/
42, AI ,"Petia Dimitrova, Chief Executive Officer and Chairperson of the Management Board of Postbank",2 November 2017.,2 ноември 2017,https://mediacenter.postbank.bg/petia-dimitrova-chief-executive-officer-chairperson-management-board-postbank-2/
43, AI ,"Petia Dimitrova, Chief Executive Officer and Chairperson of the Management Board of Postbank with Manager magazine",5 November 2018.,5 ноември 2018,https://mediacenter.postbank.bg/petia-dimitrova-chief-executive-officer-chairperson-management-board-postbank-manager-magazine/
44, AI ,"Petia Dimitrova, Chief Executive Officer and Chairperson of the Management Board of Postbank, and Ivan Nenkov, CEO of SoftUni: We are changing the market via a new strategic project, which connects business and education",26 October 2018.,26 октомври 2018,https://mediacenter.postbank.bg/petia-dimitrova-chief-executive-officer-chairperson-management-board-postbank-ivan-nenkov-ceo-softuni-changing-market-strategic-project-connects-business-education/
45, AI ,"Petia Dimitrova, Chief Executive Officer and Chairperson of the Management Board of Postbank: Digitalization is the path we follow",25 April 2019.,25 април 2019,https://mediacenter.postbank.bg/petia-dimitrova-chief-executive-officer-chairperson-management-board-postbank-digitalization-path-follow/
46, AI ,"Petia Dimitrova, Chief Executive Officer and Chairwoman of the Management Board of Postbank: People will take control over their own operations","The Bank of the Future is digital and allows customers to bank remotely, Petia Dimitrova stressed in an interview with “24 Chasa“ Daily newspaper, noting that the bank’s strategy will continue to focus on the development of digital banking channels, providing customers with invaluable advantage to bank themselves in a time and place chosen by them.",5 декември 2020,https://mediacenter.postbank.bg/petia-dimitrova-chief-executive-officer-chairwoman-management-board-postbank-people-control-operations/
47, AI ,"Petia Dimitrova, Postbank’s Chief Executive Officer and Chairperson of the Management Board: OUR GOAL IS TO PROVIDE DIGITAL SERVICES THAT ARE AS FLEXIBLE AS POSSIBLE","The speed of digitalization and introducing innovations depends on the bank itself, its strategy and desire to respond to customer needs.",3 януари 2020,https://mediacenter.postbank.bg/petia-dimitrova-postbanks-chief-executive-officer-chairperson-management-board-goal-provide-digital-services-flexible/
48, AI ,Petia Dimitrova: “Digitalization is the basis of the banking of the future”,Exclusive interview with the Chief Executive Officer and Chairperson of the Management Board of Postbank.,12 ноември 2019,https://mediacenter.postbank.bg/petia-dimitrova-digitalization-basis-banking-future/
49, AI ,Petia Dimitrova: “Reality has shown that now is the time for bold changes and digital innovations – this is why we are the first to introduce them with the unique-for-the-market express banking zones and new generation of mobile wallet”,"Postbank was awarded the prize “Bank of the Year” for 2020 – a challenging year, which once again proved that we are moving fast enough and in the right direction, said Petya Dimitrova. We have achieved good financial results, we have become bigger and more dynamic in our development and we have continued to implement innovations in the service of our customers, she said in an interview with “24 Chasa” Daily newspaper.",31 октомври 2020,https://mediacenter.postbank.bg/petia-dimitrova-reality-shown-time-bold-digital-innovations-introduce-unique-for-the-market-express-banking-zones-generation-mobile-wallet/
