,keyword,title,summary,date,href
330,големи данни,Петя Димитрова: Дигитализацията на банкирането е наша мисия,"Петя Димитрова: Дигитализацията на банкирането е наша мисия
Сп. “Икономика” Движим се с темпото на клиентите си, но и се стремим да бъдем с една крачка пред тях Г-жо Димитрова, кой е въпросът, който като банкер си задавате напоследък? - Въпросът, който ме вълнува, не е само един. Но може би най-важните в този момент са – дали и тази година ръстът на
20 март 2018
Научете повече",20 март 2018,https://mediacenter.postbank.bg/%d0%bf%d0%b5%d1%82%d1%8f-%d0%b4%d0%b8%d0%bc%d0%b8%d1%82%d1%80%d0%be%d0%b2%d0%b0-%d0%b4%d0%b8%d0%b3%d0%b8%d1%82%d0%b0%d0%bb%d0%b8%d0%b7%d0%b0%d1%86%d0%b8%d1%8f%d1%82%d0%b0-%d0%bd%d0%b0-%d0%b1%d0%b0/
331,големи данни,Петя Димитрова: Дигитализацията ни зададе още по-амбициозни цели за бъдещето,"Интервю на Петя Димитрова, главен изпълнителен директор и председател на УС на Пощенска банка за финансово-икономическия сайт Economy.bg.",28 септември 2021,https://mediacenter.postbank.bg/%d0%bf%d0%b5%d1%82%d1%8f-%d0%b4%d0%b8%d0%bc%d0%b8%d1%82%d1%80%d0%be%d0%b2%d0%b0-%d0%b4%d0%b8%d0%b3%d0%b8%d1%82%d0%b0%d0%bb%d0%b8%d0%b7%d0%b0%d1%86%d0%b8%d1%8f%d1%82%d0%b0-%d0%bd%d0%b8-%d0%b7%d0%b0/
332,големи данни,Петя Димитрова: Дигиталната трансформация е пътят към успеха,Интервю на Петя Димитрова за CEO Today. ,4 октомври 2021,https://mediacenter.postbank.bg/%d0%bf%d0%b5%d1%82%d1%8f-%d0%b4%d0%b8%d0%bc%d0%b8%d1%82%d1%80%d0%be%d0%b2%d0%b0-%d0%b4%d0%b8%d0%b3%d0%b8%d1%82%d0%b0%d0%bb%d0%bd%d0%b0%d1%82%d0%b0-%d1%82%d1%80%d0%b0%d0%bd%d1%81%d1%84%d0%be%d1%80/
333,големи данни,Петя Димитрова: Дигиталното бъдеще е сега,"Интервю с Петя Димитрова, главен изпълнителен директор и председател на Управителния съвет на Пощенска банка. Вестник “24 часа”.",10 юли 2021,https://mediacenter.postbank.bg/%d0%bf%d0%b5%d1%82%d1%8f-%d0%b4%d0%b8%d0%bc%d0%b8%d1%82%d1%80%d0%be%d0%b2%d0%b0-%d0%b4%d0%b8%d0%b3%d0%b8%d1%82%d0%b0%d0%bb%d0%bd%d0%be%d1%82%d0%be-%d0%b1%d1%8a%d0%b4%d0%b5%d1%89%d0%b5-%d0%b5-%d1%81/
334,големи данни,"Петя Димитрова: Доказахме, че сме лидер в дигиталната, а сега и ключов участник в зелената трансформация","Интервю с Петя Димитрова, главен изпълнителен директор и председател на Управителния съвет на Пощенска банка за „Капитал 100“",28 юли 2023,https://mediacenter.postbank.bg/%d0%bf%d0%b5%d1%82%d1%8f-%d0%b4%d0%b8%d0%bc%d0%b8%d1%82%d1%80%d0%be%d0%b2%d0%b0-%d0%b4%d0%be%d0%ba%d0%b0%d0%b7%d0%b0%d1%85%d0%bc%d0%b5-%d1%87%d0%b5-%d1%81%d0%bc%d0%b5-%d0%bb%d0%b8%d0%b4%d0%b5%d1%80/
335,големи данни,Петя Димитрова: Заради рестриктивните мерки в Атина гръцки капитали може да се насочат у нас,"Пазарът се саморегулира и непазарни действия винаги биха имали негативен ефект, коментира изпълнителният директор на Пощенска банка в интервю за вестник Класа.",28 май 2010,https://mediacenter.postbank.bg/%d0%bf%d0%b5%d1%82%d1%8f-%d0%b4%d0%b8%d0%bc%d0%b8%d1%82%d1%80%d0%be%d0%b2%d0%b0-%d0%b7%d0%b0%d1%80%d0%b0%d0%b4%d0%b8-%d1%80%d0%b5%d1%81%d1%82%d1%80%d0%b8%d0%ba%d1%82%d0%b8%d0%b2%d0%bd%d0%b8%d1%82/
336,големи данни,Петя Димитрова: Инвестициите в развитието на дигиталната екосистема са бъдещето на банковия сектор,"Интервю на Петя Димитрова, главен изпълнителен директор и председател на УС на Пощенска банка за списание Bulgaria On Air. ",12 ноември 2021,https://mediacenter.postbank.bg/%d0%bf%d0%b5%d1%82%d1%8f-%d0%b4%d0%b8%d0%bc%d0%b8%d1%82%d1%80%d0%be%d0%b2%d0%b0-%d0%b8%d0%bd%d0%b2%d0%b5%d1%81%d1%82%d0%b8%d1%86%d0%b8%d0%b8%d1%82%d0%b5-%d0%b2-%d1%80%d0%b0%d0%b7%d0%b2%d0%b8%d1%82/
337,големи данни,Петя Димитрова: Не трябва да се тръгва към непазарни условия за формиране на лихвите,През втората половина на годината проблемните заеми ще започнат да намаляват прогнозира Петя Димитрова в интервю за вестник Класа.,14 март 2012,https://mediacenter.postbank.bg/%d0%bf%d0%b5%d1%82%d1%8f-%d0%b4%d0%b8%d0%bc%d0%b8%d1%82%d1%80%d0%be%d0%b2%d0%b0-%d0%bd%d0%b5-%d1%82%d1%80%d1%8f%d0%b1%d0%b2%d0%b0-%d0%b4%d0%b0-%d1%81%d0%b5-%d1%82%d1%80%d1%8a%d0%b3%d0%b2%d0%b0-%d0%ba/
338,големи данни,Петя Димитрова: Обединението с “Алфа” ни издигна на четвърто място,"Придобиването на дейността на Алфа банк е важен момент както в нашата 25-годишна история, така и за сектора като цяло. В момента двете банки обединяваме своя дългогодишен опит и ресурси, за да предложим още по-добро обслужване на нашите клиенти. ",25 март 2016,https://mediacenter.postbank.bg/%d0%bf%d0%b5%d1%82%d1%8f-%d0%b4%d0%b8%d0%bc%d0%b8%d1%82%d1%80%d0%be%d0%b2%d0%b0-%d0%be%d0%b1%d0%b5%d0%b4%d0%b8%d0%bd%d0%b5%d0%bd%d0%b8%d0%b5%d1%82%d0%be-%d1%81-%d0%b0%d0%bb%d1%84%d0%b0/
339,големи данни,Петя Димитрова: Овладяването на ръста на лошите кредити до края на годината е приоритет,"Макрорамката ни е стабилна, но няма как да останем изолиран оазис, коментира изпълнителният директор на Пощенска банка в интервю за вестник Класа.",22 август 2011,https://mediacenter.postbank.bg/%d0%bf%d0%b5%d1%82%d1%8f-%d0%b4%d0%b8%d0%bc%d0%b8%d1%82%d1%80%d0%be%d0%b2%d0%b0-%d0%be%d0%b2%d0%bb%d0%b0%d0%b4%d1%8f%d0%b2%d0%b0%d0%bd%d0%b5%d1%82%d0%be-%d0%bd%d0%b0-%d1%80%d1%8a%d1%81%d1%82%d0%b0/
340,големи данни,Петя Димитрова: Пощенска банка и ПОК „Доверие“ станаха стратегически партньори в предлагането на иновативни финансови решения,"Интервю на Петя Димитрова, главен изпълнителен директор и председател на УС на Пощенска банка за Банкер.",28 октомври 2021,https://mediacenter.postbank.bg/%d0%bf%d0%b5%d1%82%d1%8f-%d0%b4%d0%b8%d0%bc%d0%b8%d1%82%d1%80%d0%be%d0%b2%d0%b0-%d0%bf%d0%be%d1%89%d0%b5%d0%bd%d1%81%d0%ba%d0%b0-%d0%b1%d0%b0%d0%bd%d0%ba%d0%b0-%d0%b8-%d0%bf%d0%be%d0%ba/
341,големи данни,Петя Димитрова: Пощенска банка печели клиентите си с отношение и внимание,"В банките има “излишък” на пари, а от това печелят потребителите, казва главният изпълнителен директор на Пощенска банка.",13 юни 2016,https://mediacenter.postbank.bg/%d0%bf%d0%b5%d1%82%d1%8f-%d0%b4%d0%b8%d0%bc%d0%b8%d1%82%d1%80%d0%be%d0%b2%d0%b0-%d0%b3%d0%bb%d0%b0%d0%b2%d0%b5%d0%bd-%d0%b8%d0%b7%d0%bf%d1%8a%d0%bb%d0%bd%d0%b8%d1%82%d0%b5%d0%bb%d0%b5%d0%bd-%d0%b4-12/
342,големи данни,Петя Димитрова: Предизвикателната среда ни провокира да бъдем още по-големи победители,"Интервю с Петя Димитрова, главен изпълнителен директор и председател на Управителния съвет на Пощенска банка за изданието Investor Digest",7 април 2023,https://mediacenter.postbank.bg/%d0%bf%d0%b5%d1%82%d1%8f-%d0%b4%d0%b8%d0%bc%d0%b8%d1%82%d1%80%d0%be%d0%b2%d0%b0-%d0%bf%d1%80%d0%b5%d0%b4%d0%b8%d0%b7%d0%b2%d0%b8%d0%ba%d0%b0%d1%82%d0%b5%d0%bb%d0%bd%d0%b0%d1%82%d0%b0-%d1%81%d1%80/
343,големи данни,"Петя Димитрова: Предлагаме иновативни продукти, базирани на клиентското преживяване","World Finance Magazine, Summer issue – July 2021.",10 юни 2021,https://mediacenter.postbank.bg/%d0%bf%d0%b5%d1%82%d1%8f-%d0%b4%d0%b8%d0%bc%d0%b8%d1%82%d1%80%d0%be%d0%b2%d0%b0-%d0%bf%d1%80%d0%b5%d0%b4%d0%bb%d0%b0%d0%b3%d0%b0%d0%bc%d0%b5-%d0%b8%d0%bd%d0%be%d0%b2%d0%b0%d1%82%d0%b8%d0%b2%d0%bd/
344,големи данни,Петя Димитрова: Прекомерната предпазливост спъва икономиката ни,"Петя Димитрова, главен изпълнителен директор на Пощенска банка, пред Bulgaria On Air: Прекомерната предпазливост спъва икономиката ни",11 декември 2012,https://mediacenter.postbank.bg/%d0%bf%d0%b5%d1%82%d1%8f-%d0%b4%d0%b8%d0%bc%d0%b8%d1%82%d1%80%d0%be%d0%b2%d0%b0-%d0%bf%d1%80%d0%b5%d0%ba%d0%be%d0%bc%d0%b5%d1%80%d0%bd%d0%b0%d1%82%d0%b0-%d0%bf%d1%80%d0%b5%d0%b4%d0%bf%d0%b0%d0%b7/
345,големи данни,"Петя Димитрова: Присъединяването ни към Еврозоната е стратегическа цел, която ще е ключова за банките през 2024 г.","Интервю с Петя Димитрова, главен изпълнителен директор и председател на УС на Пощенска банка и председател на АББ за вестник „24 часа“ ",6 декември 2023,https://mediacenter.postbank.bg/%d0%bf%d0%b5%d1%82%d1%8f-%d0%b4%d0%b8%d0%bc%d0%b8%d1%82%d1%80%d0%be%d0%b2%d0%b0-%d0%bf%d1%80%d0%b8%d1%81%d1%8a%d0%b5%d0%b4%d0%b8%d0%bd%d1%8f%d0%b2%d0%b0%d0%bd%d0%b5%d1%82%d0%be-%d0%bd%d0%b8-%d0%ba/
346,големи данни,Петя Димитрова: Регулациите продължават да бъдат едно от най-сериозните предизвикателства,Главният изпълнителен директор и председател на управителния съвет на Пощенска банка пред “Капитал”.,6 май 2017,https://mediacenter.postbank.bg/%d0%bf%d0%b5%d1%82%d1%8f-%d0%b4%d0%b8%d0%bc%d0%b8%d1%82%d1%80%d0%be%d0%b2%d0%b0-%d1%80%d0%b5%d0%b3%d1%83%d0%bb%d0%b0%d1%86%d0%b8%d0%b8%d1%82%d0%b5-%d0%bf%d1%80%d0%be%d0%b4%d1%8a%d0%bb%d0%b6%d0%b0/
347,големи данни,"Петя Димитрова: С очакваното придобиване на БНП Париба Пърсънъл Файненс, клиентите ни ще получат още по-бързи, изгодни и иновативни услуги","Интервю с Петя Димитрова, главен изпълнителен директор и председател на Управителния съвет на Пощенска банка за финансово-икономическия портал Money.bg",16 декември 2022,https://mediacenter.postbank.bg/%d0%bf%d0%b5%d1%82%d1%8f-%d0%b4%d0%b8%d0%bc%d0%b8%d1%82%d1%80%d0%be%d0%b2%d0%b0-%d1%81-%d0%be%d1%87%d0%b0%d0%ba%d0%b2%d0%b0%d0%bd%d0%be%d1%82%d0%be-%d0%bf%d1%80%d0%b8%d0%b4%d0%be%d0%b1%d0%b8%d0%b2/
348,големи данни,Петя Димитрова: Следим пазара за потенциални консолидации и сме готови да разширим присъствието си,"Интервю с Петя Димитрова, главен изпълнителен директор и председател на Управителния съвет на Пощенска банка за вестник “24 часа“",16 май 2022,https://mediacenter.postbank.bg/%d0%bf%d0%b5%d1%82%d1%8f-%d0%b4%d0%b8%d0%bc%d0%b8%d1%82%d1%80%d0%be%d0%b2%d0%b0-%d1%81%d0%bb%d0%b5%d0%b4%d0%b8%d0%bc-%d0%bf%d0%b0%d0%b7%d0%b0%d1%80%d0%b0-%d0%b7%d0%b0-%d0%bf%d0%be%d1%82%d0%b5%d0%bd/
349,големи данни,Петя Димитрова: Стремежът към иновации е запазена марка на Пощенска банка,Интервю за списание BGLOBAL,4 ноември 2022,https://mediacenter.postbank.bg/%d0%bf%d0%b5%d1%82%d1%8f-%d0%b4%d0%b8%d0%bc%d0%b8%d1%82%d1%80%d0%be%d0%b2%d0%b0-%d1%81%d1%82%d1%80%d0%b5%d0%bc%d0%b5%d0%b6%d1%8a%d1%82-%d0%ba%d1%8a%d0%bc-%d0%b8%d0%bd%d0%be%d0%b2%d0%b0%d1%86%d0%b8/
350,големи данни,Петя Димитрова: Успехът е само стъпало към нов успех,"74,5 милиарда лева са депозитите в банките, това показва доверието в системата, казва главният изпълнителен директор на Пощенска банка. ",29 юни 2017,https://mediacenter.postbank.bg/%d0%bf%d0%b5%d1%82%d1%8f-%d0%b4%d0%b8%d0%bc%d0%b8%d1%82%d1%80%d0%be%d0%b2%d0%b0-%d1%83%d1%81%d0%bf%d0%b5%d1%85%d1%8a%d1%82-%d0%b5-%d1%81%d0%b0%d0%bc%d0%be-%d1%81%d1%82%d1%8a%d0%bf%d0%b0%d0%bb%d0%be/
351,големи данни,"Петя Димитрова: Ще продължим да работим за това банките да бъдат символ на стабилни финансови институции, които оперират прозрачно и предвидимо","Интервю с Петя Димитрова, председател на УС на Асоциацията на Банките в България (АББ) за вестник “24 часа”",26 юни 2023,https://mediacenter.postbank.bg/%d0%bf%d0%b5%d1%82%d1%8f-%d0%b4%d0%b8%d0%bc%d0%b8%d1%82%d1%80%d0%be%d0%b2%d0%b0-%d1%89%d0%b5-%d0%bf%d1%80%d0%be%d0%b4%d1%8a%d0%bb%d0%b6%d0%b8%d0%bc-%d0%b4%d0%b0-%d1%80%d0%b0%d0%b1%d0%be%d1%82%d0%b8/
352,големи данни,Петя Димитрова: Ще продължим да развиваме огромния потенциал на Пощенска банка,Чувстваме се горди с постигнатото до момента и то ни дава увереност да продължим да предлагаме едни от най-добрите банкови продукти и услуги.,6 януари 2017,https://mediacenter.postbank.bg/%d0%bf%d0%b5%d1%82%d1%8f-%d0%b4%d0%b8%d0%bc%d0%b8%d1%82%d1%80%d0%be%d0%b2%d0%b0-%d1%89%d0%b5-%d0%bf%d1%80%d0%be%d0%b4%d1%8a%d0%bb%d0%b6%d0%b8%d0%bc-%d0%b4%d0%b0-%d1%80%d0%b0%d0%b7%d0%b2%d0%b8%d0%b2/
353,големи данни,Петя Димитрова: “Дигитализацията с фокус върху потребителското преживяване движи стратегията на Пощенска банка за 2020”,"Петя Димитрова, главен изпълнителен директор и председател на Управителния съвет на Пощенска банка, е представена на корицата на последния брой на списание „Bulgaria on Air“. ",3 януари 2020,https://mediacenter.postbank.bg/%d0%bf%d0%b5%d1%82%d1%8f-%d0%b4%d0%b8%d0%bc%d0%b8%d1%82%d1%80%d0%be%d0%b2%d0%b0-%d0%b4%d0%b8%d0%b3%d0%b8%d1%82%d0%b0%d0%bb%d0%b8%d0%b7%d0%b0%d1%86%d0%b8%d1%8f%d1%82%d0%b0-%d1%81-%d1%84%d0%be/
354,големи данни,Повече кредити при по-ниски лихви,"Лихвите ще продължат да падат, макар и по-плавно, което ще стимулира кредитирането и ще насочи част от спестяванията към взаимни фондове и инвестиция в имоти",4 януари 2016,https://mediacenter.postbank.bg/%d0%bf%d0%be%d0%b2%d0%b5%d1%87%d0%b5-%d0%ba%d1%80%d0%b5%d0%b4%d0%b8%d1%82%d0%b8-%d0%bf%d1%80%d0%b8-%d0%bf%d0%be-%d0%bd%d0%b8%d1%81%d0%ba%d0%b8-%d0%bb%d0%b8%d1%85%d0%b2%d0%b8/
355,големи данни,Ползващите кредитна карта харчат с 12% повече от началото на годината,Бонусите и модерните апликации за кредитни карти улесняват употребата им,29 юли 2015,https://mediacenter.postbank.bg/%d0%bf%d0%be%d0%bb%d0%b7%d0%b2%d0%b0%d1%89%d0%b8%d1%82%d0%b5-%d0%ba%d1%80%d0%b5%d0%b4%d0%b8%d1%82%d0%bd%d0%b0-%d0%ba%d0%b0%d1%80%d1%82%d0%b0-%d1%85%d0%b0%d1%80%d1%87%d0%b0%d1%82-%d1%81-12-%d0%bf%d0%be/
356,блокчейн,Борислав Диков: Предстои да пуснем на пазара най-добрия дигитален портфейл,"“Когато една финансова институция предлага адекватни решения и продукти, които спестяват на потребителите време и пари, това се отплаща и затова при нас 80% от всички плащания, преводи и трансакции са дигитални“. ",15 април 2021,https://mediacenter.postbank.bg/%d0%b1%d0%be%d1%80%d0%b8%d1%81%d0%bb%d0%b0%d0%b2-%d0%b4%d0%b8%d0%ba%d0%be%d0%b2-%d0%bf%d1%80%d0%b5%d0%b4%d1%81%d1%82%d0%be%d0%b8-%d0%b4%d0%b0-%d0%bf%d1%83%d1%81%d0%bd%d0%b5%d0%bc-%d0%bd%d0%b0-%d0%bf/
357,блокчейн,Борислав Диков: Предстои да пуснем на пазара най-добрия дигитален портфейл,"“Когато една финансова институция предлага адекватни решения и продукти, които спестяват на потребителите време и пари, това се отплаща и затова при нас 80% от всички плащания, преводи и трансакции са дигитални“. ",15 април 2021,https://mediacenter.postbank.bg/%d0%b1%d0%be%d1%80%d0%b8%d1%81%d0%bb%d0%b0%d0%b2-%d0%b4%d0%b8%d0%ba%d0%be%d0%b2-%d0%bf%d1%80%d0%b5%d0%b4%d1%81%d1%82%d0%be%d0%b8-%d0%b4%d0%b0-%d0%bf%d1%83%d1%81%d0%bd%d0%b5%d0%bc-%d0%bd%d0%b0-%d0%bf-2/
358,блокчейн,Лина Върбанова участва в петото издание на ежегодния форум за дигитални финанси NEXT DIFI 2021,"Лина Върбанова, началник отдел CRM в Пощенска банка, участва в NEXT DIFI 2021. ",11 октомври 2021,https://mediacenter.postbank.bg/%d0%bb%d0%b8%d0%bd%d0%b0-%d0%b2%d1%8a%d1%80%d0%b1%d0%b0%d0%bd%d0%be%d0%b2%d0%b0-%d1%83%d1%87%d0%b0%d1%81%d1%82%d0%b2%d0%b0-%d0%b2-%d0%bf%d0%b5%d1%82%d0%be%d1%82%d0%be-%d0%b8%d0%b7%d0%b4%d0%b0%d0%bd/
359,блокчейн,Лина Върбанова участва в петото издание на ежегодния форум за дигитални финанси NEXT DIFI 2021,"Лина Върбанова, началник отдел CRM в Пощенска банка, участва в NEXT DIFI 2021. ",11 октомври 2021,https://mediacenter.postbank.bg/%d0%bb%d0%b8%d0%bd%d0%b0-%d0%b2%d1%8a%d1%80%d0%b1%d0%b0%d0%bd%d0%be%d0%b2%d0%b0-%d1%83%d1%87%d0%b0%d1%81%d1%82%d0%b2%d0%b0-%d0%b2-%d0%bf%d0%b5%d1%82%d0%be%d1%82%d0%be-%d0%b8%d0%b7%d0%b4%d0%b0%d0%bd-2/
360,блокчейн,Лина Върбанова: Използването на аналитични данни в процесите е сред ключовите предимства на Пощенска банка,Интервю за Qorus и Wavestone,22 февруари 2023,https://mediacenter.postbank.bg/%d0%bb%d0%b8%d0%bd%d0%b0-%d0%b2%d1%8a%d1%80%d0%b1%d0%b0%d0%bd%d0%be%d0%b2%d0%b0-%d0%b8%d0%b7%d0%bf%d0%be%d0%bb%d0%b7%d0%b2%d0%b0%d0%bd%d0%b5%d1%82%d0%be-%d0%bd%d0%b0-%d0%b0%d0%bd%d0%b0%d0%bb%d0%b8/
361,блокчейн,"Петя Димитрова в проекта “Бъдещето: Парите“: Позитивът на блокчейн технологиите е, че може да са приложими в банковия бизнес","Петя Димитрова, главен изпълнителен директор и председател на УС на Пощенска банка се включи в проекта “Бъдещето: Парите“, организиран от Bulgaria ON AIR.",7 юни 2021,https://mediacenter.postbank.bg/%d0%bf%d0%b5%d1%82%d1%8f-%d0%b4%d0%b8%d0%bc%d0%b8%d1%82%d1%80%d0%be%d0%b2%d0%b0-%d0%b2-%d0%bf%d1%80%d0%be%d0%b5%d0%ba%d1%82%d0%b0-%d0%b1%d1%8a%d0%b4%d0%b5%d1%89%d0%b5%d1%82%d0%be-%d0%bf/
362,блокчейн,"Петя Димитрова в проекта “Бъдещето: Парите“: Позитивът на блокчейн технологиите е, че може да са приложими в банковия бизнес","Петя Димитрова, главен изпълнителен директор и председател на УС на Пощенска банка се включи в проекта “Бъдещето: Парите“, организиран от Bulgaria ON AIR.",7 юни 2021,https://mediacenter.postbank.bg/%d0%bf%d0%b5%d1%82%d1%8f-%d0%b4%d0%b8%d0%bc%d0%b8%d1%82%d1%80%d0%be%d0%b2%d0%b0-%d0%b2-%d0%bf%d1%80%d0%be%d0%b5%d0%ba%d1%82%d0%b0-%d0%b1%d1%8a%d0%b4%d0%b5%d1%89%d0%b5%d1%82%d0%be-%d0%bf-2/
363,блокчейн,Петя Димитрова: Банките в България са фактор за просперитета на икономиката,"Интервю с Петя Димитрова, главен изпълнителен директор и председател на УС на Пощенска банка и председател на АББ за „Труд news“",20 декември 2023,https://mediacenter.postbank.bg/%d0%bf%d0%b5%d1%82%d1%8f-%d0%b4%d0%b8%d0%bc%d0%b8%d1%82%d1%80%d0%be%d0%b2%d0%b0-%d0%b1%d0%b0%d0%bd%d0%ba%d0%b8%d1%82%d0%b5-%d0%b2-%d0%b1%d1%8a%d0%bb%d0%b3%d0%b0%d1%80%d0%b8%d1%8f-%d1%81%d0%b0-%d1%84/
364,блокчейн,Петя Димитрова: Дигитализацията ни зададе още по-амбициозни цели за бъдещето,"Интервю на Петя Димитрова, главен изпълнителен директор и председател на УС на Пощенска банка за финансово-икономическия сайт Economy.bg.",28 септември 2021,https://mediacenter.postbank.bg/%d0%bf%d0%b5%d1%82%d1%8f-%d0%b4%d0%b8%d0%bc%d0%b8%d1%82%d1%80%d0%be%d0%b2%d0%b0-%d0%b4%d0%b8%d0%b3%d0%b8%d1%82%d0%b0%d0%bb%d0%b8%d0%b7%d0%b0%d1%86%d0%b8%d1%8f%d1%82%d0%b0-%d0%bd%d0%b8-%d0%b7%d0%b0/
365,блокчейн,Петя Димитрова: Дигиталното бъдеще е сега,"Интервю с Петя Димитрова, главен изпълнителен директор и председател на Управителния съвет на Пощенска банка. Вестник “24 часа”.",10 юли 2021,https://mediacenter.postbank.bg/%d0%bf%d0%b5%d1%82%d1%8f-%d0%b4%d0%b8%d0%bc%d0%b8%d1%82%d1%80%d0%be%d0%b2%d0%b0-%d0%b4%d0%b8%d0%b3%d0%b8%d1%82%d0%b0%d0%bb%d0%bd%d0%be%d1%82%d0%be-%d0%b1%d1%8a%d0%b4%d0%b5%d1%89%d0%b5-%d0%b5-%d1%81/
366,блокчейн,Петя Димитрова: Инвестициите в развитието на дигиталната екосистема са бъдещето на банковия сектор,"Интервю на Петя Димитрова, главен изпълнителен директор и председател на УС на Пощенска банка за списание Bulgaria On Air. ",12 ноември 2021,https://mediacenter.postbank.bg/%d0%bf%d0%b5%d1%82%d1%8f-%d0%b4%d0%b8%d0%bc%d0%b8%d1%82%d1%80%d0%be%d0%b2%d0%b0-%d0%b8%d0%bd%d0%b2%d0%b5%d1%81%d1%82%d0%b8%d1%86%d0%b8%d0%b8%d1%82%d0%b5-%d0%b2-%d1%80%d0%b0%d0%b7%d0%b2%d0%b8%d1%82/
367,блокчейн,Петя Димитрова: Предизвикателната среда ни провокира да бъдем още по-големи победители,"Интервю с Петя Димитрова, главен изпълнителен директор и председател на Управителния съвет на Пощенска банка за изданието Investor Digest",7 април 2023,https://mediacenter.postbank.bg/%d0%bf%d0%b5%d1%82%d1%8f-%d0%b4%d0%b8%d0%bc%d0%b8%d1%82%d1%80%d0%be%d0%b2%d0%b0-%d0%bf%d1%80%d0%b5%d0%b4%d0%b8%d0%b7%d0%b2%d0%b8%d0%ba%d0%b0%d1%82%d0%b5%d0%bb%d0%bd%d0%b0%d1%82%d0%b0-%d1%81%d1%80/
